{"schema_name":"production-task-attempt","schema_version":"1.0.0","kernel_version":"2.0.0","task_id":"11111111111111111111111111111111","attempt_id":"222222222222222222222222","claim_generation":1,"claim_token":"33333333333333333333333333333333","envelope_sha256":"aaaaaaaaaaaaaaaaaaaaaaaaaaaaaaaaaaaaaaaaaaaaaaaaaaaaaaaaaaaaaaaa","outputs":[{"path":"outline.json","sha256":"bbbbbbbbbbbbbbbbbbbbbbbbbbbbbbbbbbbbbbbbbbbbbbbbbbbbbbbbbbbbbbbb"}]}
